17:49:02.160981 IP run-Z87X-UD3H.55122 > 151.101.125.140.https: Flags [S], seq 3227921164, win 29200, options [mss 1460,sackOK,TS val 1247220683 ecr 0,nop,wscale 7], length 0
17:49:02.162395 IP run-Z87X-UD3H.37088 > ec2-52-43-40-243.us-west-2.compute.amazonaws.com.https: Flags [P.], seq 2516794914:2516795743, ack 202495361, win 309, options [nop,nop,TS val 3164461946 ecr 1329678031], length 829
17:49:02.164833 IP run-Z87X-UD3H.37096 > ec2-52-43-40-243.us-west-2.compute.amazonaws.com.https: Flags [S], seq 519920540, win 29200, options [mss 1460,sackOK,TS val 3164461949 ecr 0,nop,wscale 7], length 0
17:49:02.193106 IP run-Z87X-UD3H.37098 > ec2-52-43-40-243.us-west-2.compute.amazonaws.com.https: Flags [S], seq 3608503926, win 29200, options [mss 1460,sackOK,TS val 3164461977 ecr 0,nop,wscale 7], length 0
17:49:02.226671 IP 151.101.125.140.https > run-Z87X-UD3H.55122: Flags [S.], seq 2190612437, ack 3227921165, win 28960, options [mss 1392,sackOK,TS val 2433904450 ecr 1247220683,nop,wscale 9], length 0
17:49:02.226701 IP run-Z87X-UD3H.55122 > 151.101.125.140.https: Flags [.], ack 1, win 229, options [nop,nop,TS val 1247220749 ecr 2433904450], length 0
17:49:02.227462 IP run-Z87X-UD3H.55122 > 151.101.125.140.https: Flags [P.], seq 1:562, ack 1, win 229, options [nop,nop,TS val 1247220749 ecr 2433904450], length 561
17:49:02.269000 IP 151.101.125.140.https > run-Z87X-UD3H.55122: Flags [.], ack 562, win 59, options [nop,nop,TS val 2433904461 ecr 1247220749], length 0
17:49:02.269115 IP 151.101.125.140.https > run-Z87X-UD3H.55122: Flags [P.], seq 1:155, ack 562, win 59, options [nop,nop,TS val 2433904461 ecr 1247220749], length 154
17:49:02.269127 IP run-Z87X-UD3H.55122 > 151.101.125.140.https: Flags [.], ack 155, win 237, options [nop,nop,TS val 1247220791 ecr 2433904461], length 0
17:49:02.269323 IP run-Z87X-UD3H.55122 > 151.101.125.140.https: Flags [P.], seq 562:613, ack 155, win 237, options [nop,nop,TS val 1247220791 ecr 2433904461], length 51
17:49:02.270185 IP run-Z87X-UD3H.55122 > 151.101.125.140.https: Flags [P.], seq 613:790, ack 155, win 237, options [nop,nop,TS val 1247220792 ecr 2433904461], length 177
17:49:02.270350 IP run-Z87X-UD3H.55122 > 151.101.125.140.https: Flags [P.], seq 790:1995, ack 155, win 237, options [nop,nop,TS val 1247220792 ecr 2433904461], length 1205
17:49:02.307886 IP 151.101.125.140.https > run-Z87X-UD3H.55122: Flags [.], ack 790, win 61, options [nop,nop,TS val 2433904471 ecr 1247220791], length 0
17:49:02.308802 IP 151.101.125.140.https > run-Z87X-UD3H.55122: Flags [P.], seq 155:221, ack 1995, win 66, options [nop,nop,TS val 2433904472 ecr 1247220792], length 66
17:49:02.308881 IP run-Z87X-UD3H.55122 > 151.101.125.140.https: Flags [P.], seq 1995:2033, ack 221, win 237, options [nop,nop,TS val 1247220831 ecr 2433904472], length 38
17:49:02.327858 IP ec2-52-43-40-243.us-west-2.compute.amazonaws.com.https > run-Z87X-UD3H.37096: Flags [S.], seq 622489515, ack 519920541, win 26847, options [mss 1392,sackOK,TS val 1329679063 ecr 3164461949,nop,wscale 8], length 0
17:49:02.327887 IP run-Z87X-UD3H.37096 > ec2-52-43-40-243.us-west-2.compute.amazonaws.com.https: Flags [.], ack 1, win 229, options [nop,nop,TS val 3164462112 ecr 1329679063], length 0
17:49:02.329097 IP run-Z87X-UD3H.37096 > ec2-52-43-40-243.us-west-2.compute.amazonaws.com.https: Flags [P.], seq 1:518, ack 1, win 229, options [nop,nop,TS val 3164462113 ecr 1329679063], length 517
17:49:02.329143 IP ec2-52-43-40-243.us-west-2.compute.amazonaws.com.https > run-Z87X-UD3H.37098: Flags [S.], seq 3303847733, ack 3608503927, win 26847, options [mss 1392,sackOK,TS val 1329679063 ecr 3164461977,nop,wscale 8], length 0
17:49:02.329160 IP run-Z87X-UD3H.37098 > ec2-52-43-40-243.us-west-2.compute.amazonaws.com.https: Flags [.], ack 1, win 229, options [nop,nop,TS val 3164462113 ecr 1329679063], length 0
17:49:02.329284 IP ec2-52-43-40-243.us-west-2.compute.amazonaws.com.https > run-Z87X-UD3H.37088: Flags [P.], seq 1:211, ack 829, win 119, options [nop,nop,TS val 1329679119 ecr 3164461946], length 210
17:49:02.330330 IP run-Z87X-UD3H.37098 > ec2-52-43-40-243.us-west-2.compute.amazonaws.com.https: Flags [P.], seq 1:518, ack 1, win 229, options [nop,nop,TS val 3164462114 ecr 1329679063], length 517
17:49:02.373302 IP run-Z87X-UD3H.37088 > ec2-52-43-40-243.us-west-2.compute.amazonaws.com.https: Flags [.], ack 211, win 329, options [nop,nop,TS val 3164462157 ecr 1329679119], length 0
17:49:02.384861 IP 151.101.125.140.https > run-Z87X-UD3H.55122: Flags [.], ack 2033, win 66, options [nop,nop,TS val 2433904491 ecr 1247220831], length 0
17:49:02.457015 IP ec2-52-43-40-243.us-west-2.compute.amazonaws.com.https > run-Z87X-UD3H.37096: Flags [.], ack 518, win 106, options [nop,nop,TS val 1329679151 ecr 3164462113], length 0
17:49:02.457038 IP ec2-52-43-40-243.us-west-2.compute.amazonaws.com.https > run-Z87X-UD3H.37098: Flags [.], ack 518, win 106, options [nop,nop,TS val 1329679151 ecr 3164462114], length 0
17:49:02.457121 IP ec2-52-43-40-243.us-west-2.compute.amazonaws.com.https > run-Z87X-UD3H.37096: Flags [P.], seq 1:146, ack 518, win 106, options [nop,nop,TS val 1329679151 ecr 3164462113], length 145
17:49:02.457134 IP run-Z87X-UD3H.37096 > ec2-52-43-40-243.us-west-2.compute.amazonaws.com.https: Flags [.], ack 146, win 237, options [nop,nop,TS val 3164462241 ecr 1329679151], length 0
17:49:02.457251 IP ec2-52-43-40-243.us-west-2.compute.amazonaws.com.https > run-Z87X-UD3H.37098: Flags [P.], seq 1:146, ack 518, win 106, options [nop,nop,TS val 1329679151 ecr 3164462114], length 145
17:49:02.457261 IP run-Z87X-UD3H.37098 > ec2-52-43-40-243.us-west-2.compute.amazonaws.com.https: Flags [.], ack 146, win 237, options [nop,nop,TS val 3164462241 ecr 1329679151], length 0
17:49:02.457458 IP run-Z87X-UD3H.37096 > ec2-52-43-40-243.us-west-2.compute.amazonaws.com.https: Flags [P.], seq 518:569, ack 146, win 237, options [nop,nop,TS val 3164462241 ecr 1329679151], length 51
17:49:02.458512 IP run-Z87X-UD3H.37096 > ec2-52-43-40-243.us-west-2.compute.amazonaws.com.https: Flags [P.], seq 569:1509, ack 146, win 237, options [nop,nop,TS val 3164462242 ecr 1329679151], length 940
17:49:02.458703 IP run-Z87X-UD3H.37098 > ec2-52-43-40-243.us-west-2.compute.amazonaws.com.https: Flags [P.], seq 518:569, ack 146, win 237, options [nop,nop,TS val 3164462243 ecr 1329679151], length 51
17:49:02.459541 IP run-Z87X-UD3H.37098 > ec2-52-43-40-243.us-west-2.compute.amazonaws.com.https: Flags [P.], seq 569:1777, ack 146, win 237, options [nop,nop,TS val 3164462243 ecr 1329679151], length 1208
17:49:02.577100 IP 151.101.125.140.https > run-Z87X-UD3H.55122: Flags [P.], seq 221:826, ack 2033, win 66, options [nop,nop,TS val 2433904539 ecr 1247220831], length 605
17:49:02.577278 IP 151.101.125.140.https > run-Z87X-UD3H.55122: Flags [.], seq 826:2214, ack 2033, win 66, options [nop,nop,TS val 2433904539 ecr 1247220831], length 1388
17:49:02.577294 IP run-Z87X-UD3H.55122 > 151.101.125.140.https: Flags [.], ack 2214, win 269, options [nop,nop,TS val 1247221099 ecr 2433904539], length 0
17:49:02.586036 IP 151.101.125.140.https > run-Z87X-UD3H.55122: Flags [.], seq 2214:3602, ack 2033, win 66, options [nop,nop,TS val 2433904539 ecr 1247220831], length 1388
17:49:02.586115 IP 151.101.125.140.https > run-Z87X-UD3H.55122: Flags [P.], seq 3602:3614, ack 2033, win 66, options [nop,nop,TS val 2433904539 ecr 1247220831], length 12
17:49:02.586127 IP run-Z87X-UD3H.55122 > 151.101.125.140.https: Flags [.], ack 3614, win 292, options [nop,nop,TS val 1247221108 ecr 2433904539], length 0
17:49:02.586958 IP 151.101.125.140.https > run-Z87X-UD3H.55122: Flags [.], seq 3614:5002, ack 2033, win 66, options [nop,nop,TS val 2433904539 ecr 1247220831], length 1388
17:49:02.587155 IP 151.101.125.140.https > run-Z87X-UD3H.55122: Flags [.], seq 5002:6390, ack 2033, win 66, options [nop,nop,TS val 2433904539 ecr 1247220831], length 1388
17:49:02.587168 IP run-Z87X-UD3H.55122 > 151.101.125.140.https: Flags [.], ack 6390, win 337, options [nop,nop,TS val 1247221109 ecr 2433904539], length 0
17:49:02.587252 IP 151.101.125.140.https > run-Z87X-UD3H.55122: Flags [P.], seq 6390:6402, ack 2033, win 66, options [nop,nop,TS val 2433904539 ecr 1247220831], length 12
17:49:02.588143 IP 151.101.125.140.https > run-Z87X-UD3H.55122: Flags [.], seq 6402:7790, ack 2033, win 66, options [nop,nop,TS val 2433904539 ecr 1247220831], length 1388
17:49:02.588157 IP run-Z87X-UD3H.55122 > 151.101.125.140.https: Flags [.], ack 7790, win 360, options [nop,nop,TS val 1247221110 ecr 2433904539], length 0
17:49:02.588335 IP 151.101.125.140.https > run-Z87X-UD3H.55122: Flags [.], seq 7790:9178, ack 2033, win 66, options [nop,nop,TS val 2433904539 ecr 1247220831], length 1388
17:49:02.588436 IP 151.101.125.140.https > run-Z87X-UD3H.55122: Flags [P.], seq 9178:9190, ack 2033, win 66, options [nop,nop,TS val 2433904539 ecr 1247220831], length 12
17:49:02.588446 IP run-Z87X-UD3H.55122 > 151.101.125.140.https: Flags [.], ack 9190, win 382, options [nop,nop,TS val 1247221110 ecr 2433904539], length 0
17:49:02.588461 IP ec2-52-43-40-243.us-west-2.compute.amazonaws.com.https > run-Z87X-UD3H.37098: Flags [.], ack 1777, win 116, options [nop,nop,TS val 1329679183 ecr 3164462243], length 0
17:49:02.588550 IP ec2-52-43-40-243.us-west-2.compute.amazonaws.com.https > run-Z87X-UD3H.37096: Flags [.], ack 1509, win 114, options [nop,nop,TS val 1329679183 ecr 3164462241], length 0
17:49:02.588677 IP ec2-52-43-40-243.us-west-2.compute.amazonaws.com.https > run-Z87X-UD3H.37096: Flags [P.], seq 146:356, ack 1509, win 114, options [nop,nop,TS val 1329679183 ecr 3164462241], length 210
17:49:02.588804 IP ec2-52-43-40-243.us-west-2.compute.amazonaws.com.https > run-Z87X-UD3H.37098: Flags [P.], seq 146:356, ack 1777, win 116, options [nop,nop,TS val 1329679184 ecr 3164462243], length 210
17:49:02.601532 IP6 run-Z87X-UD3H.39762 > 2605:8d80:6a3:1bec::4e.domain: 19274+ [1au] A? out.reddit.com. (43)
17:49:02.601597 IP6 run-Z87X-UD3H.40037 > 2605:8d80:6a3:1bec::4e.domain: 51845+ [1au] AAAA? out.reddit.com. (43)
17:49:02.608106 IP 151.101.125.140.https > run-Z87X-UD3H.55122: Flags [.], seq 9190:10578, ack 2033, win 66, options [nop,nop,TS val 2433904546 ecr 1247221099], length 1388
17:49:02.609058 IP 151.101.125.140.https > run-Z87X-UD3H.55122: Flags [.], seq 10578:11966, ack 2033, win 66, options [nop,nop,TS val 2433904546 ecr 1247221099], length 1388
17:49:02.609071 IP run-Z87X-UD3H.55122 > 151.101.125.140.https: Flags [.], ack 11966, win 427, options [nop,nop,TS val 1247221131 ecr 2433904546], length 0
17:49:02.610552 IP6 run-Z87X-UD3H.60875 > 2605:8d80:6a3:1bec::4e.domain: 61964+ [1au] A? www.redditstatic.com. (49)
17:49:02.610627 IP6 run-Z87X-UD3H.54929 > 2605:8d80:6a3:1bec::4e.domain: 49987+ [1au] AAAA? www.redditstatic.com. (49)
17:49:02.611107 IP run-Z87X-UD3H.55122 > 151.101.125.140.https: Flags [P.], seq 2033:2168, ack 11966, win 427, options [nop,nop,TS val 1247221133 ecr 2433904546], length 135
17:49:02.611269 IP6 run-Z87X-UD3H.47684 > 2605:8d80:6a3:1bec::4e.domain: 33258+ [1au] A? b.thumbs.redditmedia.com. (53)
17:49:02.611545 IP6 run-Z87X-UD3H.36783 > 2605:8d80:6a3:1bec::4e.domain: 10956+ [1au] AAAA? b.thumbs.redditmedia.com. (53)
17:49:02.611593 IP run-Z87X-UD3H.55122 > 151.101.125.140.https: Flags [P.], seq 2168:2262, ack 11966, win 427, options [nop,nop,TS val 1247221134 ecr 2433904546], length 94
17:49:02.612159 IP run-Z87X-UD3H.55122 > 151.101.125.140.https: Flags [P.], seq 2262:2591, ack 11966, win 427, options [nop,nop,TS val 1247221134 ecr 2433904546], length 329
17:49:02.612325 IP run-Z87X-UD3H.55122 > 151.101.125.140.https: Flags [P.], seq 2591:2866, ack 11966, win 427, options [nop,nop,TS val 1247221134 ecr 2433904546], length 275
17:49:02.612576 IP run-Z87X-UD3H.55122 > 151.101.125.140.https: Flags [P.], seq 2866:3140, ack 11966, win 427, options [nop,nop,TS val 1247221134 ecr 2433904546], length 274
17:49:02.612883 IP run-Z87X-UD3H.55122 > 151.101.125.140.https: Flags [P.], seq 3140:3182, ack 11966, win 427, options [nop,nop,TS val 1247221135 ecr 2433904546], length 42
17:49:02.614109 IP run-Z87X-UD3H.55122 > 151.101.125.140.https: Flags [P.], seq 3182:3224, ack 11966, win 427, options [nop,nop,TS val 1247221136 ecr 2433904546], length 42
17:49:02.614725 IP run-Z87X-UD3H.55122 > 151.101.125.140.https: Flags [P.], seq 3224:3266, ack 11966, win 427, options [nop,nop,TS val 1247221137 ecr 2433904546], length 42
17:49:02.615019 IP run-Z87X-UD3H.55122 > 151.101.125.140.https: Flags [P.], seq 3266:3308, ack 11966, win 427, options [nop,nop,TS val 1247221137 ecr 2433904546], length 42
17:49:02.615168 IP run-Z87X-UD3H.55122 > 151.101.125.140.https: Flags [P.], seq 3308:3350, ack 11966, win 427, options [nop,nop,TS val 1247221137 ecr 2433904546], length 42
17:49:02.618065 IP 151.101.125.140.https > run-Z87X-UD3H.55122: Flags [.], seq 11966:13354, ack 2033, win 66, options [nop,nop,TS val 2433904546 ecr 1247221099], length 1388
17:49:02.618246 IP 151.101.125.140.https > run-Z87X-UD3H.55122: Flags [.], seq 13354:14742, ack 2033, win 66, options [nop,nop,TS val 2433904546 ecr 1247221099], length 1388
17:49:02.618258 IP run-Z87X-UD3H.55122 > 151.101.125.140.https: Flags [.], ack 14742, win 473, options [nop,nop,TS val 1247221140 ecr 2433904546], length 0
17:49:02.619361 IP 151.101.125.140.https > run-Z87X-UD3H.55122: Flags [.], seq 14742:16130, ack 2033, win 66, options [nop,nop,TS val 2433904546 ecr 1247221108], length 1388
17:49:02.619379 IP 151.101.125.140.https > run-Z87X-UD3H.55122: Flags [.], seq 16130:17518, ack 2033, win 66, options [nop,nop,TS val 2433904546 ecr 1247221108], length 1388
17:49:02.619392 IP run-Z87X-UD3H.55122 > 151.101.125.140.https: Flags [.], ack 17518, win 518, options [nop,nop,TS val 1247221141 ecr 2433904546], length 0
17:49:02.619403 IP 151.101.125.140.https > run-Z87X-UD3H.55122: Flags [.], seq 17518:18906, ack 2033, win 66, options [nop,nop,TS val 2433904546 ecr 1247221108], length 1388
17:49:02.619713 IP 151.101.125.140.https > run-Z87X-UD3H.55122: Flags [.], seq 18906:20294, ack 2033, win 66, options [nop,nop,TS val 2433904546 ecr 1247221108], length 1388
17:49:02.619721 IP run-Z87X-UD3H.55122 > 151.101.125.140.https: Flags [.], ack 20294, win 563, options [nop,nop,TS val 1247221142 ecr 2433904546], length 0
17:49:02.619732 IP 151.101.125.140.https > run-Z87X-UD3H.55122: Flags [.], seq 20294:21682, ack 2033, win 66, options [nop,nop,TS val 2433904547 ecr 1247221109], length 1388
17:49:02.619736 IP 151.101.125.140.https > run-Z87X-UD3H.55122: Flags [.], seq 21682:23070, ack 2033, win 66, options [nop,nop,TS val 2433904547 ecr 1247221109], length 1388
17:49:02.619740 IP run-Z87X-UD3H.55122 > 151.101.125.140.https: Flags [.], ack 23070, win 608, options [nop,nop,TS val 1247221142 ecr 2433904547], length 0
17:49:02.619904 IP 151.101.125.140.https > run-Z87X-UD3H.55122: Flags [.], seq 23070:24458, ack 2033, win 66, options [nop,nop,TS val 2433904547 ecr 1247221109], length 1388
17:49:02.620096 IP 151.101.125.140.https > run-Z87X-UD3H.55122: Flags [.], seq 24458:25846, ack 2033, win 66, options [nop,nop,TS val 2433904547 ecr 1247221109], length 1388
17:49:02.620101 IP run-Z87X-UD3H.55122 > 151.101.125.140.https: Flags [.], ack 25846, win 654, options [nop,nop,TS val 1247221142 ecr 2433904547], length 0
17:49:02.620290 IP 151.101.125.140.https > run-Z87X-UD3H.55122: Flags [.], seq 25846:27234, ack 2033, win 66, options [nop,nop,TS val 2433904549 ecr 1247221110], length 1388
17:49:02.620483 IP 151.101.125.140.https > run-Z87X-UD3H.55122: Flags [.], seq 27234:28622, ack 2033, win 66, options [nop,nop,TS val 2433904549 ecr 1247221110], length 1388
17:49:02.620489 IP run-Z87X-UD3H.55122 > 151.101.125.140.https: Flags [.], ack 28622, win 699, options [nop,nop,TS val 1247221142 ecr 2433904549], length 0
17:49:02.620980 IP 151.101.125.140.https > run-Z87X-UD3H.55122: Flags [.], seq 28622:30010, ack 2033, win 66, options [nop,nop,TS val 2433904549 ecr 1247221110], length 1388
17:49:02.621172 IP 151.101.125.140.https > run-Z87X-UD3H.55122: Flags [.], seq 30010:31398, ack 2033, win 66, options [nop,nop,TS val 2433904549 ecr 1247221110], length 1388
17:49:02.621179 IP run-Z87X-UD3H.55122 > 151.101.125.140.https: Flags [.], ack 31398, win 744, options [nop,nop,TS val 1247221143 ecr 2433904549], length 0
17:49:02.625066 IP 151.101.125.140.https > run-Z87X-UD3H.55122: Flags [.], seq 31398:32786, ack 2033, win 66, options [nop,nop,TS val 2433904551 ecr 1247221110], length 1388
17:49:02.625941 IP 151.101.125.140.https > run-Z87X-UD3H.55122: Flags [.], seq 32786:34174, ack 2033, win 66, options [nop,nop,TS val 2433904551 ecr 1247221110], length 1388
17:49:02.625956 IP run-Z87X-UD3H.55122 > 151.101.125.140.https: Flags [.], ack 34174, win 789, options [nop,nop,TS val 1247221148 ecr 2433904551], length 0
17:49:02.626131 IP 151.101.125.140.https > run-Z87X-UD3H.55122: Flags [.], seq 34174:35562, ack 2033, win 66, options [nop,nop,TS val 2433904551 ecr 1247221110], length 1388
17:49:02.626995 IP 151.101.125.140.https > run-Z87X-UD3H.55122: Flags [.], seq 35562:36950, ack 2033, win 66, options [nop,nop,TS val 2433904551 ecr 1247221110], length 1388
17:49:02.627006 IP run-Z87X-UD3H.55122 > 151.101.125.140.https: Flags [.], ack 36950, win 835, options [nop,nop,TS val 1247221149 ecr 2433904551], length 0
17:49:02.628091 IP6 run-Z87X-UD3H.39700 > 2605:8d80:6a3:1bec::4e.domain: 58214+ [1au] A? a.thumbs.redditmedia.com. (53)
17:49:02.628155 IP6 run-Z87X-UD3H.54607 > 2605:8d80:6a3:1bec::4e.domain: 39131+ [1au] AAAA? a.thumbs.redditmedia.com. (53)
17:49:02.629258 IP run-Z87X-UD3H.37098 > ec2-52-43-40-243.us-west-2.compute.amazonaws.com.https: Flags [.], ack 356, win 245, options [nop,nop,TS val 3164462413 ecr 1329679184], length 0
17:49:02.629265 IP run-Z87X-UD3H.37096 > ec2-52-43-40-243.us-west-2.compute.amazonaws.com.https: Flags [.], ack 356, win 245, options [nop,nop,TS val 3164462413 ecr 1329679183], length 0
17:49:02.629340 IP6 2605:8d80:6a3:1bec::4e.domain > run-Z87X-UD3H.39762: 19274 3/4/1 A 52.202.9.181, A 34.230.170.103, A 52.5.206.7 (228)
17:49:02.629456 IP6 2605:8d80:6a3:1bec::4e.domain > run-Z87X-UD3H.40037: 51845 0/1/1 (124)
17:49:02.629652 IP run-Z87X-UD3H.47504 > ec2-52-202-9-181.compute-1.amazonaws.com.https: Flags [S], seq 2566978031, win 29200, options [mss 1460,sackOK,TS val 2845631120 ecr 0,nop,wscale 7], length 0
17:49:02.646244 IP 151.101.125.140.https > run-Z87X-UD3H.55122: Flags [.], seq 36950:38338, ack 2033, win 66, options [nop,nop,TS val 2433904556 ecr 1247221131], length 1388
17:49:02.646305 IP 151.101.125.140.https > run-Z87X-UD3H.55122: Flags [P.], seq 38338:38540, ack 2033, win 66, options [nop,nop,TS val 2433904556 ecr 1247221131], length 202
17:49:02.646315 IP run-Z87X-UD3H.55122 > 151.101.125.140.https: Flags [.], ack 38540, win 879, options [nop,nop,TS val 1247221168 ecr 2433904556], length 0
17:49:02.649740 IP6 run-Z87X-UD3H.54453 > 2605:8d80:6a3:1bec::4e.domain: 56298+ [1au] A? reddit.com. (39)
17:49:02.649838 IP6 run-Z87X-UD3H.35111 > 2605:8d80:6a3:1bec::4e.domain: 12514+ [1au] AAAA? reddit.com. (39)
17:49:02.652853 IP 151.101.125.140.https > run-Z87X-UD3H.55122: Flags [.], ack 2168, win 71, options [nop,nop,TS val 2433904558 ecr 1247221133], length 0
17:49:02.652878 IP run-Z87X-UD3H.55122 > 151.101.125.140.https: Flags [.], seq 3350:4730, ack 38540, win 879, options [nop,nop,TS val 1247221175 ecr 2433904558], length 1380
17:49:02.653943 IP 151.101.125.140.https > run-Z87X-UD3H.55122: Flags [.], ack 2262, win 71, options [nop,nop,TS val 2433904558 ecr 1247221133], length 0
17:49:02.653954 IP run-Z87X-UD3H.55122 > 151.101.125.140.https: Flags [P.], seq 4730:5797, ack 38540, win 879, options [nop,nop,TS val 1247221176 ecr 2433904558], length 1067
17:49:02.653964 IP 151.101.125.140.https > run-Z87X-UD3H.55122: Flags [.], ack 2591, win 76, options [nop,nop,TS val 2433904558 ecr 1247221133], length 0
17:49:02.654062 IP 151.101.125.140.https > run-Z87X-UD3H.55122: Flags [.], ack 2866, win 80, options [nop,nop,TS val 2433904558 ecr 1247221133], length 0
17:49:02.654706 IP 151.101.125.140.https > run-Z87X-UD3H.55122: Flags [.], seq 38540:39928, ack 2866, win 80, options [nop,nop,TS val 2433904558 ecr 1247221133], length 1388
17:49:02.655628 IP 151.101.125.140.https > run-Z87X-UD3H.55122: Flags [.], seq 39928:41316, ack 2866, win 80, options [nop,nop,TS val 2433904558 ecr 1247221133], length 1388
17:49:02.655642 IP run-Z87X-UD3H.55122 > 151.101.125.140.https: Flags [.], ack 41316, win 924, options [nop,nop,TS val 1247221178 ecr 2433904558], length 0
17:49:02.655719 IP 151.101.125.140.https > run-Z87X-UD3H.55122: Flags [P.], seq 41316:41328, ack 2866, win 80, options [nop,nop,TS val 2433904558 ecr 1247221133], length 12
17:49:02.656834 IP 151.101.125.140.https > run-Z87X-UD3H.55122: Flags [.], seq 41328:42716, ack 2866, win 80, options [nop,nop,TS val 2433904558 ecr 1247221133], length 1388
17:49:02.656846 IP run-Z87X-UD3H.55122 > 151.101.125.140.https: Flags [.], ack 42716, win 947, options [nop,nop,TS val 1247221179 ecr 2433904558], length 0
17:49:02.657024 IP 151.101.125.140.https > run-Z87X-UD3H.55122: Flags [.], seq 42716:44104, ack 2866, win 80, options [nop,nop,TS val 2433904558 ecr 1247221133], length 1388
17:49:02.657119 IP 151.101.125.140.https > run-Z87X-UD3H.55122: Flags [P.], seq 44104:44116, ack 2866, win 80, options [nop,nop,TS val 2433904558 ecr 1247221133], length 12
17:49:02.657126 IP run-Z87X-UD3H.55122 > 151.101.125.140.https: Flags [.], ack 44116, win 970, options [nop,nop,TS val 1247221179 ecr 2433904558], length 0
17:49:02.657623 IP 151.101.125.140.https > run-Z87X-UD3H.55122: Flags [.], seq 44116:45504, ack 2866, win 80, options [nop,nop,TS val 2433904558 ecr 1247221133], length 1388
17:49:02.658096 IP 151.101.125.140.https > run-Z87X-UD3H.55122: Flags [.], seq 45504:46892, ack 2866, win 80, options [nop,nop,TS val 2433904558 ecr 1247221133], length 1388
17:49:02.658102 IP run-Z87X-UD3H.55122 > 151.101.125.140.https: Flags [.], ack 46892, win 1015, options [nop,nop,TS val 1247221180 ecr 2433904558], length 0
17:49:02.658203 IP 151.101.125.140.https > run-Z87X-UD3H.55122: Flags [P.], seq 46892:46904, ack 2866, win 80, options [nop,nop,TS val 2433904558 ecr 1247221133], length 12
17:49:02.658983 IP 151.101.125.140.https > run-Z87X-UD3H.55122: Flags [.], seq 46904:48292, ack 2866, win 80, options [nop,nop,TS val 2433904558 ecr 1247221133], length 1388
17:49:02.658990 IP run-Z87X-UD3H.55122 > 151.101.125.140.https: Flags [.], ack 48292, win 1037, options [nop,nop,TS val 1247221181 ecr 2433904558], length 0
17:49:02.659178 IP 151.101.125.140.https > run-Z87X-UD3H.55122: Flags [.], seq 48292:49680, ack 2866, win 80, options [nop,nop,TS val 2433904558 ecr 1247221133], length 1388
17:49:02.659274 IP 151.101.125.140.https > run-Z87X-UD3H.55122: Flags [P.], seq 49680:49692, ack 2866, win 80, options [nop,nop,TS val 2433904558 ecr 1247221133], length 12
17:49:02.659279 IP run-Z87X-UD3H.55122 > 151.101.125.140.https: Flags [.], ack 49692, win 1060, options [nop,nop,TS val 1247221181 ecr 2433904558], length 0
17:49:02.660011 IP 151.101.125.140.https > run-Z87X-UD3H.55122: Flags [.], seq 49692:51080, ack 2866, win 80, options [nop,nop,TS val 2433904558 ecr 1247221133], length 1388
17:49:02.660762 IP 151.101.125.140.https > run-Z87X-UD3H.55122: Flags [.], seq 51080:52468, ack 2866, win 80, options [nop,nop,TS val 2433904558 ecr 1247221133], length 1388
17:49:02.660770 IP run-Z87X-UD3H.55122 > 151.101.125.140.https: Flags [.], ack 52468, win 1105, options [nop,nop,TS val 1247221183 ecr 2433904558], length 0
17:49:02.660858 IP 151.101.125.140.https > run-Z87X-UD3H.55122: Flags [P.], seq 52468:52480, ack 2866, win 80, options [nop,nop,TS val 2433904558 ecr 1247221133], length 12
17:49:02.661422 IP 151.101.125.140.https > run-Z87X-UD3H.55122: Flags [.], seq 52480:53868, ack 2866, win 80, options [nop,nop,TS val 2433904558 ecr 1247221133], length 1388
17:49:02.661430 IP run-Z87X-UD3H.55122 > 151.101.125.140.https: Flags [.], ack 53868, win 1128, options [nop,nop,TS val 1247221183 ecr 2433904558], length 0
17:49:02.662747 IP 151.101.125.140.https > run-Z87X-UD3H.55122: Flags [P.], seq 53868:55098, ack 2866, win 80, options [nop,nop,TS val 2433904558 ecr 1247221133], length 1230
17:49:02.662941 IP 151.101.125.140.https > run-Z87X-UD3H.55122: Flags [.], seq 55098:56486, ack 2866, win 80, options [nop,nop,TS val 2433904558 ecr 1247221133], length 1388
17:49:02.662949 IP run-Z87X-UD3H.55122 > 151.101.125.140.https: Flags [.], ack 56486, win 1172, options [nop,nop,TS val 1247221185 ecr 2433904558], length 0
17:49:02.664862 IP 151.101.125.140.https > run-Z87X-UD3H.55122: Flags [.], seq 56486:57874, ack 2866, win 80, options [nop,nop,TS val 2433904558 ecr 1247221133], length 1388
17:49:02.664956 IP 151.101.125.140.https > run-Z87X-UD3H.55122: Flags [P.], seq 57874:57886, ack 2866, win 80, options [nop,nop,TS val 2433904558 ecr 1247221133], length 12
17:49:02.664963 IP run-Z87X-UD3H.55122 > 151.101.125.140.https: Flags [.], ack 57886, win 1195, options [nop,nop,TS val 1247221187 ecr 2433904558], length 0
17:49:02.665749 IP 151.101.125.140.https > run-Z87X-UD3H.55122: Flags [.], seq 57886:59274, ack 2866, win 80, options [nop,nop,TS val 2433904558 ecr 1247221133], length 1388
17:49:02.666764 IP 151.101.125.140.https > run-Z87X-UD3H.55122: Flags [.], seq 59274:60662, ack 2866, win 80, options [nop,nop,TS val 2433904558 ecr 1247221133], length 1388
17:49:02.666772 IP run-Z87X-UD3H.55122 > 151.101.125.140.https: Flags [.], ack 60662, win 1240, options [nop,nop,TS val 1247221189 ecr 2433904558], length 0
17:49:02.666859 IP 151.101.125.140.https > run-Z87X-UD3H.55122: Flags [P.], seq 60662:60674, ack 2866, win 80, options [nop,nop,TS val 2433904558 ecr 1247221133], length 12
17:49:02.667642 IP 151.101.125.140.https > run-Z87X-UD3H.55122: Flags [.], seq 60674:62062, ack 2866, win 80, options [nop,nop,TS val 2433904558 ecr 1247221133], length 1388
17:49:02.667650 IP run-Z87X-UD3H.55122 > 151.101.125.140.https: Flags [.], ack 62062, win 1263, options [nop,nop,TS val 1247221190 ecr 2433904558], length 0
17:49:02.667835 IP 151.101.125.140.https > run-Z87X-UD3H.55122: Flags [.], seq 62062:63450, ack 2866, win 80, options [nop,nop,TS val 2433904558 ecr 1247221133], length 1388
17:49:02.667931 IP 151.101.125.140.https > run-Z87X-UD3H.55122: Flags [P.], seq 63450:63462, ack 2866, win 80, options [nop,nop,TS val 2433904558 ecr 1247221133], length 12
17:49:02.667937 IP run-Z87X-UD3H.55122 > 151.101.125.140.https: Flags [.], ack 63462, win 1285, options [nop,nop,TS val 1247221190 ecr 2433904558], length 0
17:49:02.668779 IP 151.101.125.140.https > run-Z87X-UD3H.55122: Flags [.], seq 63462:64850, ack 2866, win 80, options [nop,nop,TS val 2433904558 ecr 1247221133], length 1388
17:49:02.669771 IP 151.101.125.140.https > run-Z87X-UD3H.55122: Flags [.], seq 64850:66238, ack 2866, win 80, options [nop,nop,TS val 2433904558 ecr 1247221133], length 1388
17:49:02.669776 IP run-Z87X-UD3H.55122 > 151.101.125.140.https: Flags [.], ack 66238, win 1331, options [nop,nop,TS val 1247221192 ecr 2433904558], length 0
17:49:02.669867 IP 151.101.125.140.https > run-Z87X-UD3H.55122: Flags [P.], seq 66238:66250, ack 2866, win 80, options [nop,nop,TS val 2433904558 ecr 1247221133], length 12
17:49:02.670656 IP 151.101.125.140.https > run-Z87X-UD3H.55122: Flags [.], seq 66250:67638, ack 2866, win 80, options [nop,nop,TS val 2433904558 ecr 1247221133], length 1388
17:49:02.670662 IP run-Z87X-UD3H.55122 > 151.101.125.140.https: Flags [.], ack 67638, win 1353, options [nop,nop,TS val 1247221193 ecr 2433904558], length 0
17:49:02.670848 IP 151.101.125.140.https > run-Z87X-UD3H.55122: Flags [.], seq 67638:69026, ack 2866, win 80, options [nop,nop,TS val 2433904558 ecr 1247221133], length 1388
17:49:02.670945 IP 151.101.125.140.https > run-Z87X-UD3H.55122: Flags [P.], seq 69026:69038, ack 2866, win 80, options [nop,nop,TS val 2433904558 ecr 1247221133], length 12
17:49:02.670949 IP run-Z87X-UD3H.55122 > 151.101.125.140.https: Flags [.], ack 69038, win 1376, options [nop,nop,TS val 1247221193 ecr 2433904558], length 0
17:49:02.671727 IP 151.101.125.140.https > run-Z87X-UD3H.55122: Flags [.], seq 69038:70426, ack 2866, win 80, options [nop,nop,TS val 2433904558 ecr 1247221133], length 1388
17:49:02.672744 IP 151.101.125.140.https > run-Z87X-UD3H.55122: Flags [P.], seq 70426:71656, ack 2866, win 80, options [nop,nop,TS val 2433904558 ecr 1247221133], length 1230
17:49:02.672751 IP run-Z87X-UD3H.55122 > 151.101.125.140.https: Flags [.], ack 71656, win 1420, options [nop,nop,TS val 1247221195 ecr 2433904558], length 0
17:49:02.675329 IP 151.101.125.140.https > run-Z87X-UD3H.55122: Flags [.], seq 71656:73044, ack 2866, win 80, options [nop,nop,TS val 2433904558 ecr 1247221133], length 1388
17:49:02.675516 IP 151.101.125.140.https > run-Z87X-UD3H.55122: Flags [.], seq 73044:74432, ack 2866, win 80, options [nop,nop,TS val 2433904558 ecr 1247221133], length 1388
17:49:02.675523 IP run-Z87X-UD3H.55122 > 151.101.125.140.https: Flags [.], ack 74432, win 1444, options [nop,nop,TS val 1247221197 ecr 2433904558], length 0
17:49:02.675792 IP 151.101.125.140.https > run-Z87X-UD3H.55122: Flags [.], seq 74432:75820, ack 2866, win 80, options [nop,nop,TS val 2433904558 ecr 1247221133], length 1388
17:49:02.675798 IP 151.101.125.140.https > run-Z87X-UD3H.55122: Flags [.], seq 75820:77208, ack 2866, win 80, options [nop,nop,TS val 2433904558 ecr 1247221133], length 1388
17:49:02.675821 IP run-Z87X-UD3H.55122 > 151.101.125.140.https: Flags [.], ack 77208, win 1444, options [nop,nop,TS val 1247221198 ecr 2433904558], length 0
17:49:02.675887 IP 151.101.125.140.https > run-Z87X-UD3H.55122: Flags [.], ack 3182, win 85, options [nop,nop,TS val 2433904558 ecr 1247221133], length 0
17:49:02.676412 IP 151.101.125.140.https > run-Z87X-UD3H.55122: Flags [.], ack 3350, win 85, options [nop,nop,TS val 2433904560 ecr 1247221133], length 0
17:49:02.677427 IP6 2605:8d80:6a3:1bec::4e.domain > run-Z87X-UD3H.39700: 58214 2/4/1 CNAME reddit.map.fastly.net., A 151.101.125.140 (176)
17:49:02.677709 IP6 2605:8d80:6a3:1bec::4e.domain > run-Z87X-UD3H.54607: 39131 1/1/1 CNAME reddit.map.fastly.net. (146)
17:49:02.677798 IP6 run-Z87X-UD3H.36227 > 2605:8d80:6a3:1bec::4e.domain: 9846+ [1au] AAAA? reddit.map.fastly.net. (50)
17:49:02.677832 IP6 2605:8d80:6a3:1bec::4e.domain > run-Z87X-UD3H.60875: 61964 2/4/1 CNAME reddit.map.fastly.net., A 151.101.125.140 (172)
17:49:02.677951 IP6 2605:8d80:6a3:1bec::4e.domain > run-Z87X-UD3H.54929: 49987 1/1/1 CNAME reddit.map.fastly.net. (142)
17:49:02.678200 IP6 2605:8d80:6a3:1bec::4e.domain > run-Z87X-UD3H.47684: 33258 2/4/1 CNAME reddit.map.fastly.net., A 151.101.125.140 (176)
17:49:02.678606 IP6 2605:8d80:6a3:1bec::4e.domain > run-Z87X-UD3H.36783: 10956 1/1/1 CNAME reddit.map.fastly.net. (146)
17:49:02.680707 IP6 2605:8d80:6a3:1bec::4e.domain > run-Z87X-UD3H.36227: 9846 0/0/0 (39)
17:49:02.680762 IP6 run-Z87X-UD3H.36227 > 2605:8d80:6a3:1bec::4e.domain: 53489+ [1au] AAAA? reddit.map.fastly.net. (50)
17:49:02.680914 IP 151.101.125.140.https > run-Z87X-UD3H.55122: Flags [.], seq 77208:78596, ack 3350, win 85, options [nop,nop,TS val 2433904565 ecr 1247221168], length 1388
17:49:02.681744 IP 151.101.125.140.https > run-Z87X-UD3H.55122: Flags [.], seq 78596:79984, ack 3350, win 85, options [nop,nop,TS val 2433904565 ecr 1247221168], length 1388
17:49:02.681751 IP run-Z87X-UD3H.55122 > 151.101.125.140.https: Flags [.], ack 79984, win 1444, options [nop,nop,TS val 1247221204 ecr 2433904565], length 0
17:49:02.681935 IP 151.101.125.140.https > run-Z87X-UD3H.55122: Flags [.], seq 79984:81372, ack 3350, win 85, options [nop,nop,TS val 2433904565 ecr 1247221168], length 1388
17:49:02.682792 IP 151.101.125.140.https > run-Z87X-UD3H.55122: Flags [.], seq 81372:82760, ack 3350, win 85, options [nop,nop,TS val 2433904565 ecr 1247221168], length 1388
17:49:02.682798 IP run-Z87X-UD3H.55122 > 151.101.125.140.https: Flags [.], ack 82760, win 1444, options [nop,nop,TS val 1247221205 ecr 2433904565], length 0
17:49:02.682895 IP6 2605:8d80:6a3:1bec::4e.domain > run-Z87X-UD3H.36227: 53489 0/0/0 (39)
17:49:02.682944 IP6 run-Z87X-UD3H.36227 > 2605:8d80:6a3:1bec::4e.domain: 21471+ [1au] AAAA? reddit.map.fastly.net. (50)
17:49:02.684178 IP6 2605:8d80:6a3:1bec::4e.domain > run-Z87X-UD3H.54453: 56298 4/4/1 A 151.101.193.140, A 151.101.65.140, A 151.101.1.140, A 151.101.129.140 (240)
17:49:02.684236 IP6 run-Z87X-UD3H.54453 > 2605:8d80:6a3:1bec::4e.domain: 34150+ [1au] A? reddit.com. (39)
17:49:02.685187 IP6 2605:8d80:6a3:1bec::4e.domain > run-Z87X-UD3H.36227: 21471 0/0/0 (39)
17:49:02.685242 IP6 run-Z87X-UD3H.36227 > 2605:8d80:6a3:1bec::4e.domain: 36941+ [1au] AAAA? reddit.map.fastly.net. (50)
17:49:02.686517 IP6 2605:8d80:6a3:1bec::4e.domain > run-Z87X-UD3H.54453: 34150 4/0/0 A 151.101.193.140, A 151.101.129.140, A 151.101.1.140, A 151.101.65.140 (92)
17:49:02.686601 IP6 run-Z87X-UD3H.54453 > 2605:8d80:6a3:1bec::4e.domain: 57278+ [1au] A? reddit.com. (39)
17:49:02.686631 IP6 2605:8d80:6a3:1bec::4e.domain > run-Z87X-UD3H.36227: 36941 0/0/0 (39)
17:49:02.686675 IP6 run-Z87X-UD3H.36227 > 2605:8d80:6a3:1bec::4e.domain: 18722+ [1au] AAAA? reddit.map.fastly.net. (50)
17:49:02.689078 IP6 2605:8d80:6a3:1bec::4e.domain > run-Z87X-UD3H.54453: 57278 4/0/0 A 151.101.1.140, A 151.101.65.140, A 151.101.193.140, A 151.101.129.140 (92)
17:49:02.689147 IP6 run-Z87X-UD3H.54453 > 2605:8d80:6a3:1bec::4e.domain: 47405+ [1au] A? reddit.com. (39)
17:49:02.689192 IP6 2605:8d80:6a3:1bec::4e.domain > run-Z87X-UD3H.36227: 18722 0/0/0 (39)
17:49:02.689222 IP6 run-Z87X-UD3H.36227 > 2605:8d80:6a3:1bec::4e.domain: 14076+ [1au] AAAA? reddit.map.fastly.net. (50)
17:49:02.689776 IP 151.101.125.140.https > run-Z87X-UD3H.55122: Flags [.], seq 82760:84148, ack 4730, win 90, options [nop,nop,TS val 2433904567 ecr 1247221175], length 1388
17:49:02.689969 IP 151.101.125.140.https > run-Z87X-UD3H.55122: Flags [.], seq 84148:85536, ack 4730, win 90, options [nop,nop,TS val 2433904567 ecr 1247221175], length 1388
17:49:02.689979 IP run-Z87X-UD3H.55122 > 151.101.125.140.https: Flags [.], ack 85536, win 1444, options [nop,nop,TS val 1247221212 ecr 2433904567], length 0
17:49:02.690847 IP 151.101.125.140.https > run-Z87X-UD3H.55122: Flags [.], seq 85536:86924, ack 4730, win 90, options [nop,nop,TS val 2433904567 ecr 1247221175], length 1388
17:49:02.691038 IP 151.101.125.140.https > run-Z87X-UD3H.55122: Flags [.], seq 86924:88312, ack 4730, win 90, options [nop,nop,TS val 2433904567 ecr 1247221175], length 1388
17:49:02.691045 IP run-Z87X-UD3H.55122 > 151.101.125.140.https: Flags [.], ack 88312, win 1444, options [nop,nop,TS val 1247221213 ecr 2433904567], length 0
17:49:02.691233 IP 151.101.125.140.https > run-Z87X-UD3H.55122: Flags [.], seq 88312:89700, ack 4730, win 90, options [nop,nop,TS val 2433904567 ecr 1247221175], length 1388
17:49:02.691571 IP6 2605:8d80:6a3:1bec::4e.domain > run-Z87X-UD3H.54453: 47405 4/0/0 A 151.101.193.140, A 151.101.129.140, A 151.101.1.140, A 151.101.65.140 (92)
17:49:02.691639 IP6 run-Z87X-UD3H.54453 > 2605:8d80:6a3:1bec::4e.domain: 1655+ [1au] A? reddit.com. (39)
17:49:02.691689 IP6 2605:8d80:6a3:1bec::4e.domain > run-Z87X-UD3H.36227: 14076 0/0/0 (39)
17:49:02.691726 IP6 run-Z87X-UD3H.36227 > 2605:8d80:6a3:1bec::4e.domain: 32243+ [1au] AAAA? reddit.map.fastly.net. (50)
17:49:02.691901 IP 151.101.125.140.https > run-Z87X-UD3H.55122: Flags [.], seq 89700:91088, ack 4730, win 90, options [nop,nop,TS val 2433904567 ecr 1247221175], length 1388
17:49:02.691909 IP run-Z87X-UD3H.55122 > 151.101.125.140.https: Flags [.], ack 91088, win 1451, options [nop,nop,TS val 1247221214 ecr 2433904567], length 0
17:49:02.694457 IP 151.101.125.140.https > run-Z87X-UD3H.55122: Flags [.], seq 91088:92476, ack 4730, win 90, options [nop,nop,TS val 2433904567 ecr 1247221175], length 1388
17:49:02.694642 IP 151.101.125.140.https > run-Z87X-UD3H.55122: Flags [.], seq 92476:93864, ack 4730, win 90, options [nop,nop,TS val 2433904567 ecr 1247221175], length 1388
17:49:02.694649 IP run-Z87X-UD3H.55122 > 151.101.125.140.https: Flags [.], ack 93864, win 1451, options [nop,nop,TS val 1247221217 ecr 2433904567], length 0
17:49:02.695002 IP 151.101.125.140.https > run-Z87X-UD3H.55122: Flags [.], seq 93864:95252, ack 4730, win 90, options [nop,nop,TS val 2433904567 ecr 1247221175], length 1388
17:49:02.695011 IP 151.101.125.140.https > run-Z87X-UD3H.55122: Flags [.], seq 95252:96640, ack 4730, win 90, options [nop,nop,TS val 2433904567 ecr 1247221175], length 1388
17:49:02.695017 IP 151.101.125.140.https > run-Z87X-UD3H.55122: Flags [.], seq 96640:98028, ack 4730, win 90, options [nop,nop,TS val 2433904567 ecr 1247221175], length 1388
17:49:02.695041 IP run-Z87X-UD3H.55122 > 151.101.125.140.https: Flags [.], ack 98028, win 1461, options [nop,nop,TS val 1247221217 ecr 2433904567], length 0
17:49:02.695294 IP 151.101.125.140.https > run-Z87X-UD3H.55122: Flags [.], seq 98028:99416, ack 4730, win 90, options [nop,nop,TS val 2433904567 ecr 1247221175], length 1388
17:49:02.695301 IP 151.101.125.140.https > run-Z87X-UD3H.55122: Flags [.], seq 99416:100804, ack 4730, win 90, options [nop,nop,TS val 2433904567 ecr 1247221175], length 1388
17:49:02.695306 IP6 2605:8d80:6a3:1bec::4e.domain > run-Z87X-UD3H.54453: 1655 4/0/0 A 151.101.1.140, A 151.101.65.140, A 151.101.193.140, A 151.101.129.140 (92)
17:49:02.695329 IP run-Z87X-UD3H.55122 > 151.101.125.140.https: Flags [.], ack 100804, win 1461, options [nop,nop,TS val 1247221217 ecr 2433904567], length 0
17:49:02.695369 IP6 run-Z87X-UD3H.54453 > 2605:8d80:6a3:1bec::4e.domain: 27768+ [1au] A? reddit.com. (39)
17:49:02.695489 IP ec2-52-202-9-181.compute-1.amazonaws.com.https > run-Z87X-UD3H.47504: Flags [S.], seq 870342821, ack 2566978032, win 26847, options [mss 1392,sackOK,TS val 3931127750 ecr 2845631120,nop,wscale 8], length 0
17:49:02.695509 IP run-Z87X-UD3H.47504 > ec2-52-202-9-181.compute-1.amazonaws.com.https: Flags [.], ack 1, win 229, options [nop,nop,TS val 2845631185 ecr 3931127750], length 0
17:49:02.695516 IP 151.101.125.140.https > run-Z87X-UD3H.55122: Flags [.], seq 100804:102192, ack 4730, win 90, options [nop,nop,TS val 2433904567 ecr 1247221175], length 1388
17:49:02.695679 IP 151.101.125.140.https > run-Z87X-UD3H.55122: Flags [.], seq 102192:103580, ack 4730, win 90, options [nop,nop,TS val 2433904567 ecr 1247221175], length 1388
17:49:02.695872 IP 151.101.125.140.https > run-Z87X-UD3H.55122: Flags [.], seq 103580:104968, ack 4730, win 90, options [nop,nop,TS val 2433904567 ecr 1247221175], length 1388
17:49:02.696067 IP 151.101.125.140.https > run-Z87X-UD3H.55122: Flags [.], seq 104968:106356, ack 4730, win 90, options [nop,nop,TS val 2433904567 ecr 1247221175], length 1388
17:49:02.696256 IP 151.101.125.140.https > run-Z87X-UD3H.55122: Flags [.], seq 106356:107744, ack 4730, win 90, options [nop,nop,TS val 2433904567 ecr 1247221175], length 1388
17:49:02.696645 IP run-Z87X-UD3H.47504 > ec2-52-202-9-181.compute-1.amazonaws.com.https: Flags [P.], seq 1:518, ack 1, win 229, options [nop,nop,TS val 2845631187 ecr 3931127750], length 517
17:49:02.696711 IP run-Z87X-UD3H.55122 > 151.101.125.140.https: Flags [.], ack 107744, win 1422, options [nop,nop,TS val 1247221219 ecr 2433904567], length 0
17:49:02.696894 IP 151.101.125.140.https > run-Z87X-UD3H.55122: Flags [.], seq 107744:109132, ack 4730, win 90, options [nop,nop,TS val 2433904567 ecr 1247221175], length 1388
17:49:02.697086 IP 151.101.125.140.https > run-Z87X-UD3H.55122: Flags [.], seq 109132:110520, ack 4730, win 90, options [nop,nop,TS val 2433904567 ecr 1247221175], length 1388
17:49:02.697094 IP run-Z87X-UD3H.55122 > 151.101.125.140.https: Flags [.], ack 110520, win 1451, options [nop,nop,TS val 1247221219 ecr 2433904567], length 0
17:49:02.697284 IP 151.101.125.140.https > run-Z87X-UD3H.55122: Flags [.], seq 110520:111908, ack 4730, win 90, options [nop,nop,TS val 2433904567 ecr 1247221175], length 1388
